{
  "document_type": "policy_fixture",
  "schema_version": "1.0.0",
  "task_policy": {
    "document_type": "orchestrator_task_policy",
    "schema_version": "1.0.0",
    "task_id": "task-2026-08-11-state-machine",
    "spec_digest": "sha256:aaaaaaaaaaaaaaaaaaaaaaaaaaaaaaaaaaaaaaaaaaaaaaaaaaaaaaaaaaaaaaaa",
    "run_id": "run-001",
    "mandatory_gates": [
      "schema_self_check",
      "unit_tests"
    ],
    "required_evidence": [
      {
        "req_id": "unit-log",
        "digest": "sha256:dddddddddddddddddddddddddddddddddddddddddddddddddddddddddddddddd",
        "digest_required": true
      }
    ],
    "infra_signature_allowlist": [
      "SIG_RUNNER_OOM"
    ],
    "budgets": {
      "rework": 2,
      "infra_total": 1,
      "infra_per_signature": {
        "SIG_RUNNER_OOM": 1
      },
      "final_full": 1,
      "no_progress": 2
    }
  },
  "ledger": {
    "document_type": "orchestrator_ledger",
    "schema_version": "1.0.0",
    "task_id": "task-2026-08-11-state-machine",
    "spec_digest": "sha256:aaaaaaaaaaaaaaaaaaaaaaaaaaaaaaaaaaaaaaaaaaaaaaaaaaaaaaaaaaaaaaaa",
    "run_id": "run-001",
    "current_epoch": 1,
    "last_epoch": 0,
    "seen_nonces": [],
    "expected_subject": {
      "tree_digest": "sha256:bbbbbbbbbbbbbbbbbbbbbbbbbbbbbbbbbbbbbbbbbbbbbbbbbbbbbbbbbbbbbbbb",
      "changed_paths": [
        "implementation/orchestrator_policy.py"
      ]
    },
    "counters": {
      "rework_used": 0,
      "infra_total_used": 0,
      "infra_used_by_signature": {},
      "final_full_used": 0,
      "no_progress_streak": 0
    },
    "finding_registry": {
      "document_type": "finding_registry",
      "schema_version": "1.0.0",
      "findings": []
    },
    "prior_attempts": [],
    "terminal_decision": null
  },
  "execution_report": {
    "document_type": "execution_report",
    "schema_version": "1.0.0",
    "task_id": "task-2026-08-11-state-machine",
    "spec_digest": "sha256:aaaaaaaaaaaaaaaaaaaaaaaaaaaaaaaaaaaaaaaaaaaaaaaaaaaaaaaaaaaaaaaa",
    "run_id": "run-001",
    "attempt_epoch": 1,
    "nonce": "nonce-new",
    "subject": {
      "tree_digest": "sha256:bbbbbbbbbbbbbbbbbbbbbbbbbbbbbbbbbbbbbbbbbbbbbbbbbbbbbbbbbbbbbbbb",
      "changed_paths": [
        "implementation/orchestrator_policy.py"
      ]
    },
    "exit_status": "OK",
    "failure_signatures": [],
    "gate_results": {
      "schema_self_check": "PASS",
      "unit_tests": "PASS"
    },
    "evidence_artifacts": [
      {
        "req_id": "unit-log",
        "digest": "sha256:dddddddddddddddddddddddddddddddddddddddddddddddddddddddddddddddd",
        "bytes": 42
      }
    ],
    "payload": {
      "ok": true,
      "round": 3
    },
    "payload_digest": "sha256:ffffffffffffffffffffffffffffffffffffffffffffffffffffffffffffffff"
  },
  "reviewer_report": {
    "document_type": "trusted_review_projection",
    "schema_version": "1.0.0",
    "task_id": "task-2026-08-11-state-machine",
    "spec_digest": "sha256:aaaaaaaaaaaaaaaaaaaaaaaaaaaaaaaaaaaaaaaaaaaaaaaaaaaaaaaaaaaaaaaa",
    "run_id": "run-001",
    "attempt_epoch": 1,
    "review_id": "review-final-001",
    "review_digest": "sha256:eeeeeeeeeeeeeeeeeeeeeeeeeeeeeeeeeeeeeeeeeeeeeeeeeeeeeeeeeeeeeeee",
    "review_mode": "final_full",
    "coverage_scope": "full",
    "reviewed_tree_digest": "sha256:bbbbbbbbbbbbbbbbbbbbbbbbbbbbbbbbbbbbbbbbbbbbbbbbbbbbbbbbbbbbbbbb",
    "covered_paths": [
      "implementation/orchestrator_policy.py"
    ],
    "findings": [],
    "verified_finding_ids": []
  },
  "expected_outcome": "ESCALATED",
  "expected_rule_id": "R04_INCOMPLETE"
}
