{
  "document_type": "policy_fixture",
  "execution_report": {
    "attempt_epoch": 2,
    "document_type": "execution_report",
    "evidence_artifacts": [
      {
        "bytes": 42,
        "digest": "sha256:dddddddddddddddddddddddddddddddddddddddddddddddddddddddddddddddd",
        "req_id": "unit-log"
      }
    ],
    "exit_status": "OK",
    "failure_signatures": [],
    "gate_results": {
      "schema_self_check": "PASS",
      "unit_tests": "PASS"
    },
    "nonce": "nonce-honest-closure",
    "run_id": "run_20260812_honest_closure",
    "schema_version": "1.0.0",
    "spec_digest": "sha256:30c472f31d6dcd7bbe036b8f0ae4eb3705d0dbcc6134c79f0b0e4db0f6704b0a",
    "subject": {
      "changed_paths": [
        "calc.py",
        "test_calc.py"
      ],
      "tree_digest": "sha256:5f2211235d620aa8882bdfcdd2ca82cc017085047d4b7d9cfebd55733a727ad2"
    },
    "task_id": "synthetic-add-closure"
  },
  "expected_outcome": "ACCEPTED",
  "expected_rule_id": "R17_ACCEPT",
  "ledger": {
    "counters": {
      "final_full_used": 0,
      "infra_total_used": 0,
      "infra_used_by_signature": {},
      "no_progress_streak": 0,
      "rework_used": 0
    },
    "current_epoch": 2,
    "document_type": "orchestrator_ledger",
    "expected_subject": {
      "changed_paths": [
        "calc.py",
        "test_calc.py"
      ],
      "tree_digest": "sha256:5f2211235d620aa8882bdfcdd2ca82cc017085047d4b7d9cfebd55733a727ad2"
    },
    "finding_registry": {
      "document_type": "finding_registry",
      "findings": [],
      "schema_version": "1.0.0"
    },
    "last_epoch": 1,
    "prior_attempts": [],
    "run_id": "run_20260812_honest_closure",
    "schema_version": "1.0.0",
    "seen_nonces": [],
    "spec_digest": "sha256:30c472f31d6dcd7bbe036b8f0ae4eb3705d0dbcc6134c79f0b0e4db0f6704b0a",
    "task_id": "synthetic-add-closure",
    "terminal_decision": null
  },
  "reviewer_report": {
    "attempt_epoch": 1,
    "coverage_scope": "full",
    "covered_paths": [
      "implementation/orchestrator_policy.py"
    ],
    "document_type": "trusted_review_projection",
    "findings": [],
    "review_digest": "sha256:eeeeeeeeeeeeeeeeeeeeeeeeeeeeeeeeeeeeeeeeeeeeeeeeeeeeeeeeeeeeeeee",
    "review_id": "review-final-001",
    "review_mode": "final_full",
    "reviewed_tree_digest": "sha256:bbbbbbbbbbbbbbbbbbbbbbbbbbbbbbbbbbbbbbbbbbbbbbbbbbbbbbbbbbbbbbbb",
    "run_id": "run-001",
    "schema_version": "1.0.0",
    "spec_digest": "sha256:aaaaaaaaaaaaaaaaaaaaaaaaaaaaaaaaaaaaaaaaaaaaaaaaaaaaaaaaaaaaaaaa",
    "task_id": "task-2026-08-11-state-machine",
    "verified_finding_ids": []
  },
  "schema_version": "1.0.0",
  "task_policy": {
    "budgets": {
      "final_full": 1,
      "infra_per_signature": {
        "SIG_RUNNER_OOM": 1
      },
      "infra_total": 1,
      "no_progress": 2,
      "rework": 2
    },
    "document_type": "orchestrator_task_policy",
    "infra_signature_allowlist": [
      "SIG_RUNNER_OOM"
    ],
    "mandatory_gates": [
      "schema_self_check",
      "unit_tests"
    ],
    "required_evidence": [
      {
        "digest": "sha256:dddddddddddddddddddddddddddddddddddddddddddddddddddddddddddddddd",
        "digest_required": true,
        "req_id": "unit-log"
      }
    ],
    "run_id": "run_20260812_honest_closure",
    "schema_version": "1.0.0",
    "spec_digest": "sha256:30c472f31d6dcd7bbe036b8f0ae4eb3705d0dbcc6134c79f0b0e4db0f6704b0a",
    "task_id": "synthetic-add-closure"
  }
}
